{
  "name": "Hit Score Visualizer",
  "description": "Changes the scores that pop up when you hit notes.",
  "id": "hitscore",
  "version": "2.3.0",
  "author": "Christoffyw and Metalit",
  "authorIcon": "https://avatars.githubusercontent.com/u/55860414?v=4",
  "modloader": "QuestLoader",
  "download": "https://github.com/Christoffyw/HitScoreVisualizer/releases/download/2.3.0/HitScoreVisualizer_v2.3.0.qmod",
  "source": "https://github.com/Christoffyw/HitScoreVisualizer/",
  "cover": "https://raw.githubusercontent.com/Christoffyw/HitScoreVisualizer/master/Cover.jpg",
  "funding": [],
  "website": null
}
