{
  "name": "PinkCore",
  "description": "PinkCore, formerly known as PinkUtils is a core mod that ports over many required features which ensures a smooth PC-Like experience.",
  "id": "PinkCore",
  "version": "1.3.1",
  "author": "Pink, StackDoubleFlow, Lillie, RedBrumbler",
  "authorIcon": null,
  "modloader": "QuestLoader",
  "download": "https://github.com/BSMGPink/PinkUtils/releases/download/1.3.1/PinkCorev1.3.1.zip",
  "source": "https://github.com/BSMGPink/PinkUtils/",
  "cover": "https://raw.githubusercontent.com/BSMGPink/PinkUtils/master/cover.png",
  "funding": [],
  "website": null
}