{
  "name": "NoParticles",
  "description": "Allows you to disable various particles throughout the game",
  "id": "NoParticles",
  "version": "0.1.7",
  "author": "AllyPallyUK, KodenameKRAK",
  "authorIcon": "https://avatars.githubusercontent.com/u/106346717?v=4",
  "modloader": "QuestLoader",
  "download": "https://github.com/kodenamekrak/NoParticles/releases/download/0.1.7/NoParticles.qmod",
  "source": "https://github.com/kodenamekrak/NoParticles/",
  "cover": "https://raw.githubusercontent.com/kodenamekrak/NoParticles/master/cover.png",
  "funding": [],
  "website": "https://github.com/kodenamekrak/NoParticles/"
}
