{
  "name": "Trick Saber",
  "description": "Mod that lets you throw and spin your sabers every which way you want!",
  "id": "trick-saber",
  "version": "0.0.1",
  "author": "RedBrumbler",
  "authorIcon": "https://avatars.githubusercontent.com/u/91820572?v=4",
  "modloader": "QuestLoader",
  "download": "https://github.com/NuggoDEV/TrickSaber-1.28.0/releases/download/0.0.1/Tricksaber.qmod",
  "source": "https://github.com/NuggoDEV/TrickSaber-1.28.0/",
  "cover": "https://raw.githubusercontent.com/NuggoDEV/TrickSaber-1.28.0/master/cover.png",
  "funding": [],
  "website": null
}