{
  "name": "ImageCoverExpander",
  "description": "Expands the Cover Image to the full right side of the song select menu!",
  "id": "ImageCoverExpander",
  "version": "0.2.1",
  "author": "Millzy and Raine",
  "authorIcon": "https://avatars.githubusercontent.com/u/64136899?v=4",
  "modloader": "QuestLoader",
  "download": "https://github.com/raineio/ImageCoverExpander-Quest/releases/download/0.2.2/ImageCoverExpander.qmod",
  "source": "https://github.com/raineio/ImageCoverExpander-Quest/",
  "cover": null,
  "funding": [],
  "website": null
}