{
  "name": "feetsaber",
  "description": "i got bored",
  "id": "feetsaber",
  "version": "0.1.1",
  "author": "Phaze#6193 | Publisher: nesiLLL",
  "authorIcon": null,
  "modloader": "QuestLoader",
  "download": "https://github.com/phaze-the-dumb/feetsaber/releases/download/v1.0.0/feetsaber.qmod",
  "source": "https://github.com/phaze-the-dumb/feetsaber/",
  "cover": null,
  "funding": [],
  "website": null
}