{
  "name": "JDFixer",
  "description": "Configure your Jump Distance, Speed, and more with ultra precision!",
  "id": "jdfixer",
  "version": "2.0.0",
  "author": "Metalit",
  "authorIcon": "https://avatars.githubusercontent.com/u/48568911?v=4",
  "modloader": "QuestLoader",
  "download": "https://github.com/Metalit/QuestJDFixer/releases/download/v2.0.0/JDFixer.qmod",
  "source": "https://github.com/Metalit/QuestJDFixer/",
  "cover": "https://raw.githubusercontent.com/Metalit/QuestJDFixer/master/cover.png",
  "funding": [],
  "website": null
}
