{
  "name": "GaySabers",
  "description": "Makes your sabers gay (i mean glow in rainbow colors)",
  "id": "gaysabers",
  "version": "0.1.0",
  "author": "hdgamer1404Jonas",
  "authorIcon": null,
  "modloader": "QuestLoader",
  "download": "https://github.com/jxnxsdev/GaySabers/releases/download/0.1.0/GaySabers.qmod",
  "source": "https://github.com/jxnxsdev/GaySabers/",
  "cover": "https://raw.githubusercontent.com/jxnxsdev/GaySabers/master/logo.gif",
  "funding": [],
  "website": null
}