{
  "name": "ImageCoverExpander",
  "description": "Expands the Cover Image to the full right side of the song select menu!",
  "id": "ImageCoverExpander",
  "version": "0.1.4",
  "author": "Millzy and Raine",
  "authorIcon": null,
  "modloader": "QuestLoader",
  "download": "https://millzydev.itch.io/imgcoverexp-quest",
  "source": null,
  "cover": null,
  "funding": [],
  "website": null
}