{
  "name": "Score Percentage",
  "description": "shows extra information after completing a level",
  "id": "scorepercentage",
  "version": "3.2.1",
  "author": "Polly51104",
  "authorIcon": "https://avatars.githubusercontent.com/u/56835953?v=4",
  "modloader": "QuestLoader",
  "download": "https://github.com/Royston1999/ScorePercentage-Quest/releases/download/v3.2.1/ScorePercentage_v3.2.1.qmod",
  "source": "https://github.com/Royston1999/ScorePercentage-Quest/",
  "cover": "https://raw.githubusercontent.com/Royston1999/ScorePercentage-Quest/master/Cover.jpg",
  "funding": [],
  "website": null
}