{
  "name": "Slogans",
  "description": "Adds some funky customisable text in the sky",
  "id": "Slogans",
  "version": "0.1.4",
  "author": "Millzy",
  "authorIcon": null,
  "modloader": "QuestLoader",
  "download": "https://millzydev.itch.io/slogans",
  "source": null,
  "cover": null,
  "funding": [],
  "website": null
}