{
  "name": "Lapiz",
  "description": "Lapiz makes modders' lives easier by exposing utilities to them cleanly. This mod does nothing on it's own.",
  "id": "lapiz",
  "version": "0.0.7",
  "author": "Raine",
  "authorIcon": "https://avatars.githubusercontent.com/u/64136899?v=4",
  "modloader": "QuestLoader",
  "download": "https://github.com/raineaeternal/Lapiz/releases/download/v0.0.7/Lapiz.qmod",
  "source": "https://github.com/raineaeternal/Lapiz/",
  "cover": null,
  "funding": [],
  "website": "https://github.com/raineaeternal/Lapiz/"
}
